{
  "version": "v1",
  "note": "Directed edges: topicId depends on prerequisiteId. Editorial (not stated in the MOE syllabus). v1 keeps only hard, direct prerequisites; transitive edges are omitted.",
  "edgeCount": 105,
  "dependencies": [
    { "topicId": "P1.WN.2", "prerequisiteId": "P1.WN.1", "strength": "hard", "reason": "Adding and subtracting within 100 needs counting, place value and ordering of numbers to 100" },
    { "topicId": "P1.WN.3", "prerequisiteId": "P1.WN.2", "strength": "hard", "reason": "Multiplication is introduced as repeated addition of equal groups" },
    { "topicId": "P1.MO.1", "prerequisiteId": "P1.WN.1", "strength": "hard", "reason": "Counting amounts up to 100 cents or $100 needs counting to 100" },
    { "topicId": "P1.ME.1", "prerequisiteId": "P1.WN.1", "strength": "hard", "reason": "Measuring and ordering lengths in cm means reading and comparing numbers" },
    { "topicId": "P1.ME.2", "prerequisiteId": "P1.WN.1", "strength": "hard", "reason": "Telling time to 5 minutes uses counting in fives up to 60" },
    { "topicId": "P1.DR.1", "prerequisiteId": "P1.WN.1", "strength": "hard", "reason": "Reading picture graphs means counting and comparing the number of objects in sets" },

    { "topicId": "P2.WN.1", "prerequisiteId": "P1.WN.1", "strength": "hard", "reason": "Extends place value from tens and ones to hundreds" },
    { "topicId": "P2.WN.2", "prerequisiteId": "P1.WN.2", "strength": "hard", "reason": "Extends the addition and subtraction algorithms to 3 digits" },
    { "topicId": "P2.WN.2", "prerequisiteId": "P2.WN.1", "strength": "hard", "reason": "3-digit algorithms need hundreds-tens-ones place value" },
    { "topicId": "P2.WN.3", "prerequisiteId": "P1.WN.3", "strength": "hard", "reason": "Multiplication tables build on the concepts of multiplication and division" },
    { "topicId": "P2.FR.2", "prerequisiteId": "P2.FR.1", "strength": "hard", "reason": "Adding like fractions needs fraction notation and the part-whole meaning" },
    { "topicId": "P2.FR.2", "prerequisiteId": "P1.WN.2", "strength": "hard", "reason": "Adding like fractions adds the numerators" },
    { "topicId": "P2.MO.1", "prerequisiteId": "P1.MO.1", "strength": "hard", "reason": "Extends counting money to mixed amounts of dollars and cents" },
    { "topicId": "P2.MO.1", "prerequisiteId": "P2.WN.1", "strength": "hard", "reason": "Converting dollars and cents to cents only (e.g. $3.45 = 345¢) uses 3-digit place value" },
    { "topicId": "P2.FR.1", "prerequisiteId": "P1.WN.1", "strength": "hard", "reason": "Writing fractions and comparing them with denominators up to 12 needs reading and comparing whole numbers" },
    { "topicId": "P2.ME.1", "prerequisiteId": "P1.ME.1", "strength": "hard", "reason": "Extends measuring and comparing length in cm to metres, mass and volume" },
    { "topicId": "P2.ME.2", "prerequisiteId": "P1.ME.2", "strength": "hard", "reason": "Extends telling time from 5 minutes to the minute" },
    { "topicId": "P2.ME.2", "prerequisiteId": "P2.WN.2", "strength": "hard", "reason": "Converting hours and minutes to minutes (e.g. 2 h 15 min = 135 min) adds multiples of 60 beyond 100" },
    { "topicId": "P2.GE.1", "prerequisiteId": "P1.GE.1", "strength": "hard", "reason": "Patterns are made from the 2D shapes identified in P1" },
    { "topicId": "P2.DR.1", "prerequisiteId": "P1.DR.1", "strength": "hard", "reason": "Extends reading picture graphs to graphs where one picture stands for several objects" },
    { "topicId": "P2.DR.1", "prerequisiteId": "P2.WN.3", "strength": "hard", "reason": "Reading a scale (one picture = 2, 5 or 10 objects) uses the multiplication tables" },

    { "topicId": "P3.WN.1", "prerequisiteId": "P2.WN.1", "strength": "hard", "reason": "Extends place value to thousands" },
    { "topicId": "P3.WN.2", "prerequisiteId": "P2.WN.2", "strength": "hard", "reason": "Extends the addition and subtraction algorithms to 4 digits" },
    { "topicId": "P3.WN.2", "prerequisiteId": "P3.WN.1", "strength": "hard", "reason": "4-digit algorithms need thousands place value" },
    { "topicId": "P3.WN.3", "prerequisiteId": "P3.WN.1", "strength": "hard", "reason": "Products of 3-digit by 1-digit numbers can reach 4 digits" },
    { "topicId": "P3.WN.3", "prerequisiteId": "P2.WN.3", "strength": "hard", "reason": "Extends the multiplication tables to 6, 7, 8 and 9 and builds algorithms on them" },
    { "topicId": "P3.WN.3", "prerequisiteId": "P2.WN.2", "strength": "hard", "reason": "The multiplication algorithm adds partial products with renaming" },
    { "topicId": "P3.FR.1", "prerequisiteId": "P2.FR.1", "strength": "hard", "reason": "Equivalent fractions build on fraction notation and the part-whole meaning" },
    { "topicId": "P3.FR.1", "prerequisiteId": "P3.WN.3", "strength": "hard", "reason": "Denominators up to 12 need the 6–9 times tables to find equivalent fractions and simplest form" },
    { "topicId": "P3.FR.2", "prerequisiteId": "P3.FR.1", "strength": "hard", "reason": "Adding related fractions first rewrites one as an equivalent fraction" },
    { "topicId": "P3.FR.2", "prerequisiteId": "P2.FR.2", "strength": "hard", "reason": "Extends adding like fractions to related fractions" },
    { "topicId": "P3.MO.1", "prerequisiteId": "P2.MO.1", "strength": "hard", "reason": "Needs reading and writing money in decimal notation" },
    { "topicId": "P3.MO.1", "prerequisiteId": "P2.WN.2", "strength": "hard", "reason": "Adding and subtracting money uses the addition and subtraction algorithms" },
    { "topicId": "P3.ME.1", "prerequisiteId": "P2.ME.1", "strength": "hard", "reason": "Extends measuring in m, kg, g and ℓ to km, ml and compound units" },
    { "topicId": "P3.ME.1", "prerequisiteId": "P3.WN.1", "strength": "hard", "reason": "Converting compound units (e.g. 2 km 300 m = 2300 m) uses thousands place value" },
    { "topicId": "P3.ME.2", "prerequisiteId": "P2.ME.2", "strength": "hard", "reason": "Finding start time, end time or duration builds on measuring time in hours and minutes" },
    { "topicId": "P3.AV.1", "prerequisiteId": "P3.WN.3", "strength": "hard", "reason": "Area of a rectangle is length × breadth" },
    { "topicId": "P3.AV.1", "prerequisiteId": "P2.ME.1", "strength": "hard", "reason": "Area and perimeter are measured in cm and m (cm², m²)" },
    { "topicId": "P3.AV.1", "prerequisiteId": "P1.GE.1", "strength": "hard", "reason": "Area and perimeter of a rectangle or square need identifying rectangles and squares" },
    { "topicId": "P3.GE.2", "prerequisiteId": "P3.GE.1", "strength": "hard", "reason": "Perpendicular lines are defined by meeting at a right angle" },
    { "topicId": "P3.DR.1", "prerequisiteId": "P2.DR.1", "strength": "hard", "reason": "Extends reading graphs with scales to bar graphs" },

    { "topicId": "P4.WN.1", "prerequisiteId": "P3.WN.1", "strength": "hard", "reason": "Extends place value to ten thousands" },
    { "topicId": "P4.WN.2", "prerequisiteId": "P3.WN.3", "strength": "hard", "reason": "Factors and multiples are defined through multiplication and division, including remainders" },
    { "topicId": "P4.WN.3", "prerequisiteId": "P3.WN.3", "strength": "hard", "reason": "Extends the multiplication and division algorithms to more digits" },
    { "topicId": "P4.WN.3", "prerequisiteId": "P4.WN.1", "strength": "hard", "reason": "Products of 4-digit by 1-digit numbers can reach 5 digits" },
    { "topicId": "P4.FR.1", "prerequisiteId": "P2.FR.1", "strength": "hard", "reason": "Extends fraction notation to fractions greater than one whole" },
    { "topicId": "P4.FR.1", "prerequisiteId": "P3.WN.3", "strength": "hard", "reason": "Converting an improper fraction to a mixed number is division with remainder" },
    { "topicId": "P4.FR.2", "prerequisiteId": "P2.FR.1", "strength": "hard", "reason": "Extends the fraction as part of a whole to part of a set" },
    { "topicId": "P4.FR.2", "prerequisiteId": "P2.WN.3", "strength": "hard", "reason": "A fraction of a set divides the set into equal groups" },
    { "topicId": "P4.FR.3", "prerequisiteId": "P3.FR.2", "strength": "hard", "reason": "Extends adding related fractions to unrelated denominators" },
    { "topicId": "P4.FR.3", "prerequisiteId": "P4.FR.1", "strength": "hard", "reason": "Answers may exceed one whole and are written as improper fractions or mixed numbers" },
    { "topicId": "P4.FR.3", "prerequisiteId": "P4.WN.2", "strength": "hard", "reason": "Unlike denominators are rewritten over a common multiple" },
    { "topicId": "P4.DE.1", "prerequisiteId": "P4.WN.1", "strength": "hard", "reason": "Decimal place value and rounding extend whole-number place value and rounding" },
    { "topicId": "P4.DE.1", "prerequisiteId": "P3.FR.1", "strength": "hard", "reason": "Converting between decimals and fractions uses equivalent fractions with denominators 10 and 100" },
    { "topicId": "P4.DE.2", "prerequisiteId": "P4.DE.1", "strength": "hard", "reason": "Adding decimals aligns digits by decimal place value" },
    { "topicId": "P4.DE.2", "prerequisiteId": "P3.WN.2", "strength": "hard", "reason": "Uses the column addition and subtraction algorithms" },
    { "topicId": "P4.DE.3", "prerequisiteId": "P4.DE.1", "strength": "hard", "reason": "Needs decimal place value and rounding to a given number of decimal places" },
    { "topicId": "P4.DE.3", "prerequisiteId": "P4.WN.3", "strength": "hard", "reason": "Uses the multiplication and division algorithms by a 1-digit number" },
    { "topicId": "P4.AV.1", "prerequisiteId": "P3.AV.1", "strength": "hard", "reason": "Reverses and combines the area and perimeter formulas for rectangles and squares" },
    { "topicId": "P4.GE.1", "prerequisiteId": "P3.GE.1", "strength": "hard", "reason": "Measuring angles in degrees builds on the concept of angle and the right angle" },
    { "topicId": "P4.GE.1", "prerequisiteId": "P2.WN.1", "strength": "hard", "reason": "Reading a protractor scale up to 180° needs numbers beyond 100" },